{
  "$schema": "https://json-schema.org/draft/2020-12/schema",
  "type": "object",
  "properties": {
    "id": {
      "type": "string",
      "pattern": "^[a-z0-9]+(?:_[a-z0-9]+)*$"
    },
    "name": {
      "type": "string",
      "minLength": 1
    },
    "countries": {
      "default": [],
      "type": "array",
      "items": {
        "type": "string",
        "pattern": "^[A-Z]{3}$"
      }
    },
    "focuses": {
      "minItems": 1,
      "type": "array",
      "items": {
        "type": "object",
        "properties": {
          "id": {
            "type": "string",
            "pattern": "^[a-z0-9]+(?:_[a-z0-9]+)*$"
          },
          "name": {
            "type": "string",
            "minLength": 1
          },
          "description": {
            "type": "string",
            "minLength": 1
          },
          "x": {
            "type": "integer",
            "minimum": -9007199254740991,
            "maximum": 9007199254740991
          },
          "y": {
            "type": "integer",
            "minimum": 0,
            "maximum": 9007199254740991
          },
          "icon": {
            "type": "string"
          },
          "days": {
            "default": 70,
            "type": "integer",
            "exclusiveMinimum": 0,
            "maximum": 9007199254740991
          },
          "prerequisites": {
            "default": [],
            "type": "array",
            "items": {
              "minItems": 1,
              "type": "array",
              "items": {
                "type": "string",
                "pattern": "^[a-z0-9]+(?:_[a-z0-9]+)*$"
              }
            }
          },
          "mutually_exclusive": {
            "default": [],
            "type": "array",
            "items": {
              "type": "string",
              "pattern": "^[a-z0-9]+(?:_[a-z0-9]+)*$"
            }
          },
          "available": {},
          "bypass": {},
          "effects": {
            "default": [],
            "type": "array",
            "items": {}
          },
          "ai_weight": {
            "default": 1,
            "type": "number",
            "minimum": 0
          }
        },
        "required": [
          "id",
          "name",
          "description",
          "x",
          "y"
        ],
        "additionalProperties": false
      }
    },
    "source": {
      "minItems": 1,
      "type": "array",
      "items": {
        "type": "object",
        "properties": {
          "url": {
            "type": "string",
            "format": "uri"
          },
          "title": {
            "type": "string",
            "minLength": 1
          },
          "accessed": {
            "type": "string",
            "format": "date",
            "pattern": "^(?:(?:\\d\\d[2468][048]|\\d\\d[13579][26]|\\d\\d0[48]|[02468][048]00|[13579][26]00)-02-29|\\d{4}-(?:(?:0[13578]|1[02])-(?:0[1-9]|[12]\\d|3[01])|(?:0[469]|11)-(?:0[1-9]|[12]\\d|30)|(?:02)-(?:0[1-9]|1\\d|2[0-8])))$",
            "description": "Calendar date, YYYY-MM-DD"
          },
          "note": {
            "type": "string"
          }
        },
        "required": [
          "url",
          "title",
          "accessed"
        ],
        "additionalProperties": false
      }
    },
    "confidence": {
      "type": "string",
      "enum": [
        "verified",
        "needs_review"
      ]
    },
    "note": {
      "type": "string"
    }
  },
  "required": [
    "id",
    "name",
    "focuses"
  ],
  "additionalProperties": false
}
